{"$schema":"https://json-schema.org/draft/2020-12/schema","$id":"https://parallelhue.org/schemas/compatibility-v1.json","title":"ParallelHue compatibility record v1","type":"object","additionalProperties":false,"required":["schema_version","verdict","model","hardware","software","guardrails","server_flags","launch_attempts","validation","restoration","provenance"],"properties":{"$schema":{"type":"string","minLength":1},"schema_version":{"const":1},"verdict":{"enum":["PASS","BLOCKED_BEFORE_SERVER_HEALTH"]},"model":{"$ref":"#/$defs/model"},"hardware":{"$ref":"#/$defs/hardware"},"software":{"$ref":"#/$defs/software"},"guardrails":{"$ref":"#/$defs/guardrails"},"server_flags":{"type":"array","minItems":1,"items":{"type":"string","minLength":1}},"launch_attempts":{"type":"array","minItems":1,"items":{"$ref":"#/$defs/launch_attempt"}},"validation":{"$ref":"#/$defs/validation"},"restoration":{"$ref":"#/$defs/restoration"},"provenance":{"$ref":"#/$defs/provenance"}},"$defs":{"quantity":{"type":"object","additionalProperties":false,"required":["value","unit","kind","n","same_condition"],"properties":{"value":{"type":"number"},"unit":{"type":"string","minLength":1},"kind":{"enum":["measured","observed","derived","condition"]},"n":{"type":"integer","minimum":0},"same_condition":{"type":["boolean","string"],"enum":[true,false,"N/A"]}}},"model":{"type":"object","additionalProperties":false,"required":["requested_identity","actual_identity","repo","quantization"],"properties":{"requested_identity":{"type":"string","minLength":1},"actual_identity":{"type":"string","minLength":1},"repo":{"type":"string","minLength":1},"base_model":{"type":"string","minLength":1},"revision":{"type":"string","minLength":1},"architecture":{"type":"string","minLength":1},"parameters":{"$ref":"#/$defs/quantity"},"quantization":{"$ref":"#/$defs/quantization"}}},"quantization":{"type":"object","additionalProperties":false,"required":["method"],"properties":{"method":{"type":"string","minLength":1},"bits":{"$ref":"#/$defs/quantity"},"group_size":{"$ref":"#/$defs/quantity"},"zero_point":{"type":"boolean"},"version":{"type":"string","minLength":1},"unquantized_modules":{"type":"array","items":{"type":"string","minLength":1}}}},"hardware":{"type":"object","additionalProperties":false,"required":["gpu_name","gpu_count","vram","driver","driver_cuda"],"properties":{"gpu_index":{"$ref":"#/$defs/quantity"},"gpu_name":{"type":"string","minLength":1},"gpu_count":{"$ref":"#/$defs/quantity"},"vram":{"$ref":"#/$defs/quantity"},"driver":{"type":"string","minLength":1},"driver_cuda":{"type":"string","minLength":1}}},"software":{"type":"object","additionalProperties":false,"required":["vllm","torch","torch_cuda","parallelhue"],"properties":{"vllm":{"type":"string","minLength":1},"vllm_mode":{"type":"string","minLength":1},"torch":{"type":"string","minLength":1},"torch_cuda":{"type":"string","minLength":1},"flashinfer_python":{"type":"string","minLength":1},"flashinfer_cubin":{"type":"string","minLength":1},"parallelhue":{"type":"string","minLength":1}}},"guardrails":{"type":"object","additionalProperties":false,"required":["guarded","environment","resource_limits","socket_mode"],"properties":{"guarded":{"type":"boolean"},"environment":{"type":"object","additionalProperties":false,"properties":{"CUDA_VISIBLE_DEVICES":{"type":"string","minLength":1},"HF_HUB_OFFLINE":{"type":"string","minLength":1},"VLLM_PLUGINS":{"type":"string","minLength":1},"PARALLELHUE_VLLM_EXACT":{"type":"string","minLength":1},"FLASHINFER_DISABLE_VERSION_CHECK":{"type":"string","minLength":1}}},"resource_limits":{"type":"object","additionalProperties":false,"properties":{"MemoryMax":{"type":"string","minLength":1},"MemorySwapMax":{"type":"string","minLength":1},"TORCHINDUCTOR_COMPILE_THREADS":{"type":"string","minLength":1},"MAX_JOBS":{"type":"string","minLength":1},"NVCC_THREADS":{"type":"string","minLength":1}}},"socket_mode":{"type":"string","minLength":1}}},"launch_attempt":{"type":"object","additionalProperties":false,"required":["backend","exit_status","health","blocker"],"properties":{"backend":{"type":"string","minLength":1},"label":{"type":"string","minLength":1},"exit_status":{"$ref":"#/$defs/quantity"},"health":{"type":"boolean"},"blocker":{"type":["string","null"]}}},"validation_run":{"type":"object","additionalProperties":false,"required":["status","n","same_condition","kind"],"properties":{"status":{"type":"string","minLength":1},"label":{"type":"string","minLength":1},"exit_status":{"$ref":"#/$defs/quantity"},"n":{"type":"integer","minimum":0},"same_condition":{"type":["boolean","string"],"enum":[true,false,"N/A"]},"kind":{"enum":["measured","observed","derived","condition"]}}},"validation":{"type":"object","additionalProperties":false,"required":["exact","fallback","event_count","sequence_count","step_id_count","color_slot_count","finished_count","terminal_completion","text_token_ids_byte_identical"],"properties":{"exact":{"$ref":"#/$defs/validation_run"},"fallback":{"$ref":"#/$defs/validation_run"},"event_count":{"$ref":"#/$defs/quantity"},"sequence_count":{"$ref":"#/$defs/quantity"},"sequence_range":{"$ref":"#/$defs/range"},"step_id_count":{"$ref":"#/$defs/quantity"},"step_range":{"$ref":"#/$defs/range"},"color_slot_count":{"$ref":"#/$defs/quantity"},"finished_count":{"$ref":"#/$defs/quantity"},"terminal_completion":{"type":["boolean","string"],"enum":[true,false,"N/A","NOT_OBSERVED"]},"text_token_ids_byte_identical":{"type":["boolean","string"],"enum":[true,false,"N/A","NOT_OBSERVED"]}}},"range":{"type":"object","additionalProperties":false,"required":["min","max","unit","kind","n","same_condition"],"properties":{"min":{"type":"number"},"max":{"type":"number"},"unit":{"type":"string","minLength":1},"kind":{"enum":["measured","observed","derived","condition"]},"n":{"type":"integer","minimum":0},"same_condition":{"type":["boolean","string"],"enum":[true,false,"N/A"]}}},"restoration":{"type":"object","additionalProperties":false,"required":["restored","summary"],"properties":{"restored":{"const":true},"summary":{"type":"string","minLength":1}}},"provenance":{"type":"object","additionalProperties":false,"required":["source","captured_at","sanitized","caveat"],"properties":{"source":{"type":"string","minLength":1},"captured_at":{"type":"string","minLength":1},"sanitized":{"const":true},"caveat":{"type":"string","minLength":1}}}}}
